{
  "$schema": "https://json-schema.org/draft/2020-12/schema",
  "title": "AI Development Task State",
  "type": "object",
  "required": [
    "task_id",
    "status",
    "created_at",
    "updated_at"
  ],
  "properties": {
    "task_id": {
      "type": "string",
      "pattern": "^TASK-[0-9]+$"
    },
    "status": {
      "type": "string",
      "enum": [
        "NEW",
        "ANALYZING",
        "PLANNING",
        "AWAITING_APPROVAL",
        "IMPLEMENTING",
        "VALIDATING",
        "REPLANNING",
        "VALIDATED",
        "PR_READY",
        "COMPLETED",
        "FAILED"
      ]
    },
    "created_at": {
      "type": "string"
    },
    "updated_at": {
      "type": "string"
    },
    "plan_version": {
      "type": "integer",
      "minimum": 1
    },
    "plan_file": {
      "type": [
        "string",
        "null"
      ]
    },
    "branch": {
      "type": [
        "string",
        "null"
      ]
    },
    "worktree": {
      "type": [
        "string",
        "null"
      ]
    },
    "failure_reason": {
      "type": [
        "string",
        "null"
      ]
    },
    "baseline_file": {
      "description": "Immutable pre-implementation snapshot of the working tree, captured once at the implement gate. Never re-captured on a replan: work the task already did would otherwise be relabelled as pre-existing.",
      "type": [
        "string",
        "null"
      ]
    },
    "baseline_sha256": {
      "description": "Digest of the baseline's content, also recorded in the BASELINE_CAPTURED event. Both must agree or validation fails closed.",
      "type": [
        "string",
        "null"
      ]
    }
  },
  "additionalProperties": false
}
