{
  "task_id": "TASK-007",
  "status": "PR_READY",
  "created_at": "2026-09-02T14:25:31.862460+05:30",
  "updated_at": "2026-09-04T14:31:55.476688+05:30",
  "plan_version": 5,
  "plan_file": ".ai\\tasks\\TASK-007\\plan-v5.json",
  "branch": null,
  "worktree": null,
  "failure_reason": null,
  "baseline_file": ".ai\\tasks\\TASK-007\\baseline.json",
  "baseline_sha256": "8dcd85c3421827c3069f41cba1c17fc5acd66f5e9822a667f022327dd27f9b42"
}
